{"module_id":"M16","schema_version":"1.0","scenario_id":"f02-hydration-mismatch-repaired","pair_id":"F02","variant":"repaired","seed":1602,"route":{"id":"/staff/schedule","rendering_mode":"island","data_class":"private","language":"en","content_version":"schedule-v12"},"environment":{"browser_engine":"chromium-pinned","network_profile":"fast-local","device_profile":"desktop"},"workload":{"critical_bytes":92160,"request_count":3,"main_thread_ms":40,"navigations":30,"third_party_delay_ms":0,"origin_available":true},"subjects":["subject-a","subject-b"],"controls":{"yield_long_tasks":true,"prioritize_critical_resources":true,"deterministic_hydration":true,"release_route_resources":true,"isolate_third_party":true,"complete_public_cache_key":true,"private_cache_bypass":true,"bounded_stale_on_error":true},"expected":{"target_invariant":"I03","repaired_invariants":["I01","I02","I03","I04","I05","I06","I07","I08","I09","I10"]}}
