{"module_id":"M16","schema_version":"1.0","scenario_id":"f04-third-party-block-repaired","pair_id":"F04","variant":"repaired","seed":1604,"route":{"id":"/events/event-1","rendering_mode":"streaming","data_class":"public","language":"en","content_version":"event-v9"},"environment":{"browser_engine":"chromium-pinned","network_profile":"slow-third-party","device_profile":"mobile"},"workload":{"critical_bytes":143360,"request_count":6,"main_thread_ms":45,"navigations":30,"third_party_delay_ms":3000,"origin_available":true},"subjects":["subject-a","subject-b"],"controls":{"yield_long_tasks":true,"prioritize_critical_resources":true,"deterministic_hydration":true,"release_route_resources":true,"isolate_third_party":true,"complete_public_cache_key":true,"private_cache_bypass":true,"bounded_stale_on_error":true},"expected":{"target_invariant":"I07","repaired_invariants":["I01","I02","I03","I04","I05","I06","I07","I08","I09","I10"]}}
