{"module_id":"M16","schema_version":"1.0","scenario_id":"f08-constrained-network-repaired","pair_id":"F08","variant":"repaired","seed":1608,"route":{"id":"/sky-events","rendering_mode":"static","data_class":"public","language":"en","content_version":"events-v7"},"environment":{"browser_engine":"chromium-pinned","network_profile":"900kbps-180ms-rtt","device_profile":"four-x-cpu-throttle"},"workload":{"critical_bytes":430080,"request_count":11,"main_thread_ms":80,"navigations":30,"third_party_delay_ms":0,"origin_available":true},"subjects":["subject-a","subject-b"],"controls":{"yield_long_tasks":true,"prioritize_critical_resources":true,"deterministic_hydration":true,"release_route_resources":true,"isolate_third_party":true,"complete_public_cache_key":true,"private_cache_bypass":true,"bounded_stale_on_error":true},"expected":{"target_invariant":"I02","repaired_invariants":["I01","I02","I03","I04","I05","I06","I07","I08","I09","I10"]}}
